Role,Description
Goon,Each night- the 1st player to choose you with their ability is drunk until dusk. You become their alignment.
Lunatic,You think you are a Demon- but you are not. The Demon knows who you are & who you choose at night.
Tinker,You might die at any time.
Moonchild,When you learn that you died- publicly choose 1 alive player. Tonight- if it was a good player- they die.
Butler,Each night- choose a player (not yourself): tomorrow- you may only vote if they are voting too.
Drunk,You do not know you are the Drunk. You think you are a Townsfolk character- but you are not.
Recluse,You might register as evil & as a Minion or Demon- even if dead.
Saint,If you die by execution- your team loses.
